{
  "workstream": "L",
  "generatedAt": "2026-09-18T00:00:00Z",
  "endpointsUsed": [
    {
      "url": "https://www.rijksfinancien.nl/",
      "retrieved": "2026-09-18",
      "notes": "Landing page; links to open data, begroting pages and the current Miljoenennota 2027."
    },
    {
      "url": "https://www.rijksfinancien.nl/open-data/overzicht-datasets",
      "retrieved": "2026-09-18",
      "notes": "Open data index; Begrotingsstaten 2013-2027 and Miljoenennota bijlagen."
    },
    {
      "url": "https://www.rijksfinancien.nl/sites/default/files/bestanden/open_data/Begrotingsstaten_2013-2027.json",
      "retrieved": "2026-09-18",
      "notes": "Primary machine-readable per-chapter, per-article budget and realisation dataset (7.947 rows, 2013-2027)."
    },
    {
      "url": "https://www.rijksfinancien.nl/sites/default/files/bestanden/open_data/Begrotingsstaten_2013-2027.csv",
      "retrieved": "2026-09-18",
      "notes": "CSV of the same dataset; header confirms the columns."
    },
    {
      "url": "https://www.rijksfinancien.nl/sites/default/files/bestanden/open_data/MJN-2027_Bijlagen_2_Uitgaven_en_Niet_Belastingontvangsten.xlsx",
      "retrieved": "2026-09-18",
      "notes": "Miljoenennota 2027 bijlage 2, tabellen 2.2 and 2.3, used to cross-check 2026 and 2027 budget totals."
    },
    {
      "url": "https://www.rijksfinancien.nl/open-data/api-documentatie",
      "retrieved": "2026-09-18",
      "notes": "API documentation; points to /swagger.json. API returns budgettaire_tabellen and financiele_instrumenten."
    },
    {
      "url": "https://www.rijksfinancien.nl/swagger.json",
      "retrieved": "2026-09-18",
      "notes": "OpenAPI 3.1 spec for the open-data API."
    },
    {
      "url": "https://www.rijksfinancien.nl/open-data/api/json/v2/financiele_instrumenten/hoofdstukken",
      "retrieved": "2026-09-18",
      "notes": "Per-chapter instrument totals in EUR for 2016-2025; covers only four chapters, used only as a unit cross-check (OCW 2025 = 54.986.484.000 EUR matches 54.986.484 x 1.000)."
    },
    {
      "url": "https://www.rijksfinancien.nl/open-data/api/json/budgettaire_tabellen?year=2025",
      "retrieved": "2026-09-18",
      "notes": "Article-level budget table for 2025 (phases OWB/JV, 6.374 rows); verantwoordelijk_minister is null throughout, so not used for the mapping."
    },
    {
      "url": "https://www.officielebekendmakingen.nl/stcrt-2026-8177",
      "retrieved": "2026-09-18",
      "notes": "KB of 23 February 2026 on the herindeling of Asiel en Migratie, VRO and Klimaat en Groene Groei."
    }
  ],
  "organizations": [],
  "positions": [],
  "people": [],
  "tenures": [],
  "memberships": [],
  "relations": [],
  "topics": [],
  "budgets": [
    {
      "organization": "org:ministerie-van-algemene-zaken",
      "fiscalYear": 2025,
      "unit": "EUR x 1,000",
      "current": {
        "spendingBudget": 117978,
        "spendingActual": 118473,
        "revenue": 13827,
        "net": 104646,
        "nonprofit": null
      },
      "previous": {
        "spendingBudget": 115134,
        "spendingActual": 118111,
        "revenue": 9083,
        "net": 109028,
        "nonprofit": null
      },
      "history": [
        {
          "fiscalYear": 2013,
          "spendingActual": 59280,
          "revenue": 9216
        },
        {
          "fiscalYear": 2014,
          "spendingActual": 59520,
          "revenue": 6390
        },
        {
          "fiscalYear": 2015,
          "spendingActual": 60588,
          "revenue": 6732
        },
        {
          "fiscalYear": 2016,
          "spendingActual": 59327,
          "revenue": 6558
        },
        {
          "fiscalYear": 2017,
          "spendingActual": 61570,
          "revenue": 6200
        },
        {
          "fiscalYear": 2018,
          "spendingActual": 64473,
          "revenue": 6150
        },
        {
          "fiscalYear": 2019,
          "spendingActual": 66433,
          "revenue": 6340
        },
        {
          "fiscalYear": 2020,
          "spendingActual": 75196,
          "revenue": 6680
        },
        {
          "fiscalYear": 2021,
          "spendingActual": 82341,
          "revenue": 7085
        },
        {
          "fiscalYear": 2022,
          "spendingActual": 83622,
          "revenue": 9400
        },
        {
          "fiscalYear": 2023,
          "spendingActual": 92522,
          "revenue": 8955
        },
        {
          "fiscalYear": 2024,
          "spendingActual": 118111,
          "revenue": 9083
        }
      ],
      "sources": [
        {
          "source": "src:rijksfinancien-begrotingsstaten-2013-2027",
          "retrieved": "2026-09-18",
          "confidence": "high"
        }
      ]
    },
    {
      "organization": "org:ministerie-van-algemene-zaken",
      "fiscalYear": 2026,
      "unit": "EUR x 1,000",
      "current": {
        "spendingBudget": 117087,
        "spendingActual": null,
        "revenue": 10084,
        "net": 107003,
        "nonprofit": null
      },
      "previous": {
        "spendingBudget": 117978,
        "spendingActual": 118473,
        "revenue": 13827,
        "net": 104646,
        "nonprofit": null
      },
      "history": [],
      "sources": [
        {
          "source": "src:rijksfinancien-begrotingsstaten-2013-2027",
          "retrieved": "2026-09-18",
          "confidence": "high"
        },
        {
          "source": "src:rijksfinancien-mjn-2027-bijlage-2",
          "retrieved": "2026-09-18",
          "confidence": "high"
        }
      ]
    },
    {
      "organization": "org:ministerie-van-algemene-zaken",
      "fiscalYear": 2027,
      "unit": "EUR x 1,000",
      "current": {
        "spendingBudget": 112663,
        "spendingActual": null,
        "revenue": 9511,
        "net": 103152,
        "nonprofit": null
      },
      "previous": {
        "spendingBudget": 117087,
        "spendingActual": null,
        "revenue": 10084,
        "net": 107003,
        "nonprofit": null
      },
      "history": [],
      "sources": [
        {
          "source": "src:rijksfinancien-begrotingsstaten-2013-2027",
          "retrieved": "2026-09-18",
          "confidence": "high"
        },
        {
          "source": "src:rijksfinancien-mjn-2027-bijlage-2",
          "retrieved": "2026-09-18",
          "confidence": "high"
        }
      ]
    },
    {
      "organization": "org:ministerie-van-binnenlandse-zaken-en-koninkrijksrelaties",
      "fiscalYear": 2025,
      "unit": "EUR x 1,000",
      "current": {
        "spendingBudget": 14450301,
        "spendingActual": 13449283,
        "revenue": 2709250,
        "net": 10740033,
        "nonprofit": null
      },
      "previous": {
        "spendingBudget": 11770724,
        "spendingActual": 11137469,
        "revenue": 1320658,
        "net": 9816811,
        "nonprofit": null
      },
      "history": [
        {
          "fiscalYear": 2013,
          "spendingActual": 1117216,
          "revenue": 201725
        },
        {
          "fiscalYear": 2014,
          "spendingActual": 1415567,
          "revenue": 594967
        },
        {
          "fiscalYear": 2015,
          "spendingActual": 1208268,
          "revenue": 939931
        },
        {
          "fiscalYear": 2016,
          "spendingActual": 1199950,
          "revenue": 263558
        },
        {
          "fiscalYear": 2017,
          "spendingActual": 1233661,
          "revenue": 209145
        },
        {
          "fiscalYear": 2018,
          "spendingActual": 6576480,
          "revenue": 1397284
        },
        {
          "fiscalYear": 2019,
          "spendingActual": 5813234,
          "revenue": 808864
        },
        {
          "fiscalYear": 2020,
          "spendingActual": 7813270,
          "revenue": 985719
        },
        {
          "fiscalYear": 2021,
          "spendingActual": 9460816,
          "revenue": 1091484
        },
        {
          "fiscalYear": 2022,
          "spendingActual": 7650004,
          "revenue": 875689
        },
        {
          "fiscalYear": 2023,
          "spendingActual": 9759944,
          "revenue": 1148573
        },
        {
          "fiscalYear": 2024,
          "spendingActual": 11137469,
          "revenue": 1320658
        }
      ],
      "sources": [
        {
          "source": "src:rijksfinancien-begrotingsstaten-2013-2027",
          "retrieved": "2026-09-18",
          "confidence": "high"
        }
      ]
    },
    {
      "organization": "org:ministerie-van-binnenlandse-zaken-en-koninkrijksrelaties",
      "fiscalYear": 2026,
      "unit": "EUR x 1,000",
      "current": {
        "spendingBudget": 14567828,
        "spendingActual": null,
        "revenue": 2903308,
        "net": 11664520,
        "nonprofit": null
      },
      "previous": {
        "spendingBudget": 14450301,
        "spendingActual": 13449283,
        "revenue": 2709250,
        "net": 10740033,
        "nonprofit": null
      },
      "history": [],
      "sources": [
        {
          "source": "src:rijksfinancien-begrotingsstaten-2013-2027",
          "retrieved": "2026-09-18",
          "confidence": "high"
        },
        {
          "source": "src:rijksfinancien-mjn-2027-bijlage-2",
          "retrieved": "2026-09-18",
          "confidence": "high"
        }
      ]
    },
    {
      "organization": "org:ministerie-van-binnenlandse-zaken-en-koninkrijksrelaties",
      "fiscalYear": 2027,
      "unit": "EUR x 1,000",
      "current": {
        "spendingBudget": 15163420,
        "spendingActual": null,
        "revenue": 2333107,
        "net": 12830313,
        "nonprofit": null
      },
      "previous": {
        "spendingBudget": 14567828,
        "spendingActual": null,
        "revenue": 2903308,
        "net": 11664520,
        "nonprofit": null
      },
      "history": [],
      "sources": [
        {